{
    "$schema": "http://json-schema.org/schema#",
    "type": "object",
    "properties": {
        "type": {
            "type": "string"
        },
        "id": {
            "type": "string"
        },
        "spec_version": {
            "type": "string"
        },
        "objects": {
            "type": "array",
            "items": {
                "type": "object",
                "properties": {
                    "object_marking_refs": {
                        "type": "array",
                        "items": {
                            "type": "string"
                        }
                    },
                    "type": {
                        "type": "string"
                    },
                    "name": {
                        "type": "string"
                    },
                    "description": {
                        "type": "string"
                    },
                    "x_mitre_shortname": {
                        "type": "string"
                    },
                    "modified": {
                        "type": "string"
                    },
                    "id": {
                        "type": "string"
                    },
                    "created": {
                        "type": "string"
                    },
                    "created_by_ref": {
                        "type": "string"
                    },
                    "external_references": {
                        "type": "array",
                        "items": {
                            "type": "object",
                            "properties": {
                                "source_name": {
                                    "type": "string"
                                },
                                "external_id": {
                                    "type": "string"
                                },
                                "url": {
                                    "type": "string"
                                }
                            },
                            "required": [
                                "external_id",
                                "source_name",
                                "url"
                            ]
                        }
                    }
                },
                "required": [
                    "created",
                    "created_by_ref",
                    "description",
                    "external_references",
                    "id",
                    "modified",
                    "name",
                    "object_marking_refs",
                    "type",
                    "x_mitre_shortname"
                ]
            }
        }
    },
    "required": [
        "id",
        "objects",
        "spec_version",
        "type"
    ]
}